날짜,제목,조회수,공감,비공감,본문
2024.06.10 04:58,■투자 성공을 위해 읽어두면 좋은 돈 이야기 2,38757,0,0,"화폐는 인위적인 것이므로 단 하나도 곡식처럼 늘어나지 않으며, 자가증식되어 스스로 증식되지도 않는다.


이것을 자연법칙으로 이해하면


현재 인류 문명에서 금융과 경제의 인식의 기준으로 인식하는 이자와 금리가 자연법칙에서 불가능이라는 것을

이해하게 된다.


그 결과 인류가 현실 인식의 근거로 사용하는 서양의 모든 지식체계인 학문 전체가 붕괴된다는 것은 자연법칙이다.


서양 문명이라는 채권문명은 빚과 이자가 유발하는 자연법칙과 수학의 불가능인 이자(금리)를 가능과 능력으로 인식하여 무한대로 확장된 문명이기 때문이다(불가능이 어떻게 가능으로 이행되는가는 생략).


이것을 이해하면 인류 문명의 시작부터 현재의 인류 문명과 전혀 다른 문명이 존재한다는 것을 알게 된다.






자연법칙 : 화폐(통화)가 자가증식으로 늘어나지 않(기 때문에 이자를 만들지 않)는 것은 자연법칙이다.


상 식 : 돈을 빚으로 빌리면 이자를 붙여 갚는 것은 문명의 법과 상식의 의무이자 양심이다.



자연법칙과 상식의 모순을 이해하면 서양 문명의 철학과 사상, 종교와 윤리에 근거하여 만들어진

경제학, 경영학, 법학의 금융제도와 경제체제, 행정학과 세법, 인문학과 인문사회학에서 문학과 예술의 인간의 모든 문제까지 모든 것이 오직 자연법칙이 인식되는 순간 불가능을 가능과 능력으로 자신의 이성과 지성으로 이행하기 때문에 스스로 갚을 수 없는 부채노예가 되는 사악한 사기와 기만, 공상과 환상에 근거한 허상이라는 것을 인간과 신의 인식의 근원인 자연법칙과 수학으로 인식하게 되므로 붕괴된 것이다.

서양문명은 화폐의 자기확장성 가치, 즉 화폐는 수요공급이론에 의지와 욕망에 따라 확장되거나

노동을 늘리면 당연히 그 증대된 노동가치를 증명할 화폐가 전제되거나 늘어난다는 관념에서 무한대로 확장된 문명이기 때문이다.

자연법칙과 상식의 모순을 모르기에 금리를 안다고 생각하지만 사실은 모른다는 사실조차 모르면서 자신은 거짓과 왜곡괸 지식을 외워서 다 안다고 착각하거나 모르면서 아는 척 스스로까지 속이는 것에 불과하다. 그래서 경제학으로는 단 하나의 사실인식도 불과능하므로 단 하나의 문제도 해결할 수 없는 것이다. 단지 더 많은 빚을 돈으로 빌려 스스로 갚을 수 없는 노예로 만드는 사악한 단 하나의 진실도 존재하지 않는 거짓의 학문일 뿐이다.


그러므로 인류의 지배적 이념인 민주주의와 자본주의 이념의 헌법의 모든 가치는 자연법칙과 수학으로 부정되는 이유는
인류가 사유할 수 있는 모든 국가와 이념의 형식의 전제조건이 바로 화폐와 발행권이라는 것은 수학저 인문학이기 때문이다.


인류 문명의 시작부터 불가능을 가능과 능력으로 이행하는 현재의 인류 문명과 전혀 다른 문명이 자연법칙과 상식의 모순이 이율배반으로 조화되는 문명이 존재한다는 것을 자연법칙과 상식의 모순으로 이해하게 된다. 여기에는 수많은 지식이 생략되어 있지만 사유로 그 모든 지식을 채울 수 있다.



작금의 지구문명은 이것을 이해하는 국가와 민족이 그렇지 못한 국가와 민족을 자연법칙과 수학으로 정복해 나가는 과도기적 과정이고, 이것을 이해하는 국가와 민족들이 문명의 주인이 되고 인류의 주인이 되기 위해 패권을 경쟁하는 것이다.


결론은 소수가 이 지식을 알면 정복의 수단이 되지만 인류 전체가 알면 자연법칙과 상식의 모순이라는 불가능은 공존의 수단이 된다.




#.이자의 무한성 -존 휘플(John Whipple)이라는 저술가가 1850년에 쓴 논문 <고리대금법의 중요성(The Importance of Usury Laws)에 그가 한 계산이 나온다. 「영국 돈 5페니를···서력기원 시작 때 5% 복리로 빌려 지금(1850년)까지 왔다면, 표준 순도의 금으로 직경 8,000마일짜리 공(거의 지구만한 크기다)을 만들 경우 323억 6,664만 8,157개에 달한다.」 인간은 유한하지만 국가라는 헌법의 가치를 실현하도록 설계된 유기체는 무한하므로 이자의 무한성이 국가를 수학적으로 붕괴시킴. 이것이 이자의 무서움.



산수 2018년 세계부채총액 280조 달러이고, 통화량 80조 달러 통계에서 금리를 올리면 오직 상식의 관념인 갚아야 할 부채총액인 280조 달러가 조작하는 이자율에 따라 관념에서 위조되는 구할 수 없는 이자만 추가되므로 갚아야 할 빚만 늘어나는 것으로 불가능만이 커지는 것에 불과하다. 통화량 80조 달러를 모두 모아도 갚아야 할 부채인 280조 달러에 200조 달러가 부족하다. 200조 달러는 이미 이자로 사라진 것이고, 80조 달러에서 단 일원도 늘어나지 않는다는 것은 자연법칙이다. 금리조작은 오직 불가능의 가속도로 금융과 경제를 파괴하는 것에 불과하지만 이자인 금리의 의미를 모르기 때문에 위기의 극복책으로 인식되지만, 생존의 전제인 화폐와 통화를 파괴하여 노동과 교환, 자본으로부터 소외시켜서 살인과 학살하는 사기와 범죄에 불과하지만 빚과 이자를 이해하지 못하는 인류에게는 불가능의 크기를 조작하는 범죄를 고매한 지적 헌신으로 인식되는 것이다.





엘렌 H. 브라운. 달러. 도서출판AK, 2012. P88~89 -

빚으로 하는 정복은 소리 없이, 그리고 부지불식간에 이루어지기 때문에 피정복민들은 새 주인이 생겼다는 사실을 깨닫지 못한다. 표면상으로는 변한 건 아무것도 없다(한국이 1997년 외환위기를 극복했다고 인식하는 이유. 애초에 위기의 원인과 목적을 이해하지 못하니 IMF구조조정을 극복했다고 자랑하는 것처럼). 이 나라는 그저 다루는 방식이 바뀌었을 뿐이다. 공물은 빚과 세금이라는 형태로 거뒀고, 사람들은 그게 자기들의 행복을 위해 내는 것이라고 믿었다. 엠리는 이렇게 썼다. ""포식자는 후원자가 되고 보호자가 됐다. 이 점을 깨닫지 못하면 그들은 정복당한 것이고, 그들 자신의 사회가 지닌 여러 도구들(국가제도와 법)은 그들의 부를 포식다들에게 나르고 정복을 완성하는 데 쓰이게 된다.""





■■■Gold VS Silver VS Bitcoin, 젊은사람들은 어디에 투자??


“화폐를 지배하기 위해 금을 지배해야 하고, 금을 지배하기 위해 은을 지배해야 한다.“


지구에 존재하는 금과 은의 비율은 과거 인류 역사에서는 1 대 16이였다. 그러나 현재 금과 은의 존재비율은 1대 2가 된다. 이유는 금은 산업에 사용되었다가도 회수되어 현재 인류가 소유할 것으로 기대되는 총량은 25톤이다. 그러나 수백개 산업에서 수백년간 사용되었던 은은 그 가치가 너무나 낮아서 회수하는 비용이 높아 버려졌다. 그래서 현재 인류가 소유할 수 있는 금과 은의 존재비율은 1대 2다. 인류가 소유할 수 있는 금은 25만톤 은은 50만톤(조금 늘어날 수 있지만 지금도 사용되다 버려지는 은은 너무 많고, 병원에서 수백개 산업, 특히 태양광과 전기차, AI인공지능 등 전기전도율이 생명이 산업으로 확장). 화폐전쟁3편. 10장 은의 영광과 몽상 참조.


과거 서양의 제국주의 열강들은 중남미의 아즈텍, 잉카, 마야 등과 그 지역의 은광에서 채굴한 은, 미국 서부개척시대 채굴한 은, 중국에 ㅇㅍ을 파라 중국의 은본위제를 붕괴시킨 은, 일본에 ㅈㅊ을 팔아 가져온 은 등을 중앙은행에 쌓아두었다. 이자도 유발되지 않는 은을 소수의 금융가들이 빌려서 시장에 매각해 그 자금을 당시 높은 금리의 채권에 투자하여 그 차익을 거두었다. 그런데 사자질 수 없는 물질인 은은 수백개 산업에서 사용되다 버려져 다시 인류가 회수할 수 없게 된 것이다. 그래서 그들은 이런 진정한 산업적 가치와 투자의 가치, 인류 역사의 진정한 돈이라는 은의 가격이 상승하는 것을 막는 것이다. 그래서 1대 16이었고, 현재 1대 2인 금은비에도 불구하고 시장에서 금과 은의 가격은 1대 90까지 벌어진 것이다.

방법은 바로 은 하나에 파생상품 100개를 만들어 실물은에 투자하는 번거로움을 분사시킨다. 그결과 하나의 병마개로 백 개의 병을 막는 것이다. 문제는 이렇게 확장된 파생시장은 본질적은 은의 부족으로 뱅크런과 같은 파산으로 내몰린다는 것이다. 이것이 미국의 은투자열풍이자 은가격을 조작하는 IB를 상대로 벌이는 금융투자 현상이다. 이런 화폐와 금융의 다층적 현상에서 Bitcoin과 같은 가상화폐현상을 이해해야 한다. 화폐를 발행하는 자는 자연법칙과 수학의 불가능으로 화폐로 교환하는 주체와 교환되는 대상 전체를 불가능으로 지배하는 전제군주가 된다는 것을 의미하기 때문이다. 이것이 패권전쟁의 핵심이다.


은은 미래를 살 젊은이들에게 부의 축적의 기회를 제공하는 이유이자 금융전쟁, 금융위기와 경제위기로부터 자신과 사회를 보호하기 위해 적은 투자금으로 반드시 투자해야 하는 것이다. 그래서 중국이나 현재의 한국에서 1g의 금모으기보다 1kg의 은을 구매하는 것이 투자수익의 측면에서 기대되는 이유이다. 사악한 자들이 악의에서 본의 아니게 준 우연한 기회이다.




골드바 100kg + 실버바 9톤=실버바 9,000개 = 어느 부자의 투자내역? 스마트 머니가 이동하는 중







금과 은의 존재비는현재 1 vs 2인데 가격차를 1 vs 90으로 만든 방법.


금값을 올리려는 이유는 국제은행가들이 중앙은행제도와 부분준비제도로 운영되는 서양의 국가들의 국가부채상승 때문. 전 세계 중앙은행 소유의 금의 72%의 가치를 높여 부채비율을 낮추기 위해. 금값을 올려야 하는 이유를 가로막는 것이 은가격의 상승이다(설명함). 금값조작 은가격 조작가능. 그러나 서양 국가들의 부채위기는 사실상 QE라는 무한대의 돈풀기, 즉 생산과 노동의 분야가 아니라 오직 금융을 지배하여 세계를 지배하는 금융기관과 경제와 산업을 통제하는 금융산업에 대한 지원(돈풀기)에 투입되어 세계와 인류 전체의 노동가치를 파괴(화폐가치를 떨어뜨리는 인플레이션 유발)하기 위한 양적 완화.

금융을 통해 금가격과 은가격의 조작(파생상품).

엘렌 H. 브라운. 달러. 도서출판AK, 2012. P206-1915년 3월 JP모건(P189~191) 사업체들(철강, 조선, 화약업체 등)과 그 부수 조직들이 언론계 고위층 열두 명을 불러 모아 미국에서 가장 영향력 있는 신문들을 고르고 미국 일간지의 논조를 대강 통제하는 데 필요한 인원을 그들 가운데서 고르도록 했다. ···그들은 큰 신문 가운데 25개 신문에 대한 통제권만을 확보하면 충분하다고 결론을 내렸다. 25개 신문에 대해 합의를 본 뒤에 이들 신문의 논조(내정 및 국제 문제에 관한 논조)를 사들이기 위한 밀사가 파견되었다. ···적절한 감독을 위해 각 신문에 편집인이 배치됐다. 군비와 군사, 금융정책 그리고 국내 및 여라 나라의 자연에 대한 기차 사항들에 관한 편집 정보는 구매자의 이익에 매우 중대한 것으로 간주됐고, 서비스 대상 업체의 바람과 반대되는 것은 모두 싣지 않도록 했다. [서양의 저널리즘은 환상]인류에게 허용된 자유란 노예될 자유뿐이다. 시온의 칙훈서에 금권이 얼마의 비율로 신문과 같은 언론을 소유해야 하는 비율까지 지침.

언론과 교육을 통한 인류 5,000년 이상의 역사에서 진정한 돈인 금과 은에 투자해야 하는 지식을 제거하고 화폐라는 currency에 집착시킴(이유와 방법은 논외). 금본위제도로 달러라는 미국과 미국인이 빚으로 빌린 은행가들의 사적 표시를 기축통화로 만든 역사.


이런 진실한 가치는 낮게 유지시키지만 반대로 중국이 금지시킨 가상화폐에 대한 투자는 조장하여 QE로 급겨기 팽창시킨 통화가 은투자로 넘어오지 못하도록 항상 투기적 금융상품을 만들어 주기적으로 거래를 활성화시켜 버블을 유발하여 화폐를 탈취한다. 가상화폐나 암호화폐는 문명의 상징인 전기의 블랙아웃에서 무용지물이지만 이런 세계금융을 지배하는 소수의 엘리트들의 자의에 따라 투자의 수단이 되어 금융거래가 되지만 그들이 불법으로 간주하는 순간 무가치가 되는 것도 현실. 그리고 그들만이 오직 가상화폐를 최고의 가격으로 올려놓을 수 있다. 그들은 인류의 모든 사회에서 화폐를 지배하므로 지구를 살 수 있는 화폐를 펜 한번 휘갈겨 만들어 낼 수 있는 주체이기 때문이다. 펜을 한번 휘갈겨 지구를 모두 사면 바로 독일 바이마르 공화국에서 유발된 초인플레이션이 일어날 것이다. 그들의 의지이다. 반대로 금과 은은 그들이 만들어낸 종이와 숫자로 살 수 있지만 만들어 낼 수 없다.



엘렌 H. 브라운. 달러. 도서출판AK, 2012. P148-노예제는 전쟁 세력에 의해 폐지될 듯하며, 가산노예제는 이미 무너졌다. 나와 유럽 친구들은 이를 반기고 있다. 노예제란 노동력을 소유하고 거기에 따라 노동자를 보살펴줘야 하는 것이다. 그러나 영국을 필두로 한 유럽 방식은 자본이 임금을 통제해 노동을 통제한다. 이는 돈을 통제함으로써 이룰 수 있다. 자본가들이 보게 될 막대한 빚은 전쟁을 통해 만들어지는 것인데, 통화 규모를 통제하는 수단으로 이용돼야 한다. 이를 이루기 위해 채권(준비금 참조)이 금융의 통대로 이용돼야 한다. 그린백이라 불리는 것은 잠시라도 돈으로 통용돼서는 안 된다. 우리가 통제할 수 없는 것이기 때문이다.

과학의 진보가 자본가의 주인인 은행가들에게 노예제보다 노동자제도가 더 이익이라는 것을 이해해서 그들이 노예제를 붕괴시킨 것이지 인류가 인문학적 진보로 노예를 해방시킨 것이아니다.그들이 그 역사적 영광을 굶주린 개에게 살점 한 점을 적선하듯 링컨에게 준 것이다. 그들은 그런 수준이다. 미국의 독립전쟁의 진정한 원인은 차에 대한 세금이 아니라 바로 화폐 지식이 있던 그 당시 미국인들이 은행가들의 사주를 받은 영국왕이 식민지 자체의 화폐발행을 막고 교환에 필요한 모든 돈을 영국은행가들에게 금을 빚으로 빌리게 만들었기에 그당시 모든 경제와 금융의 불황의 원인을 명확히 인식한 그들이 선택할 수 있는 선택은 혁명뿐이었기에 시작된 것이다. 인류 역사 아래 전혀 다른 역사가 흐른다.


인류가 누리는 문명적 삶은 과학이 없다면 지금 당장 가위바위보로 단 한 명을 지배계층이 되고 나머지 9명이 노예가 되어 먹여 살리는 봉건적 계급질서로 회귀해야 하는 그 부처가 말한 지혜가 바로 과학이다. 역사가 이럴진대 인류 문명에 진실이 얼마가 존재하겠는가?

노예제도로 이 거대한 메트로폴리탄 도시가 만들어질 수 있고 또 유지될 수 있겠는가? 그들이 진정한 지구의 문명이기에 인류의 인구를 줄이는 계획까지 세우고 시행하는 것이다. 단지 노예가 노동자가 되었기에 세금이 있고 그렇게 살아가는 노동자가 주권의 멍에를 씌워서 국가들을 전쟁으로 내몰아 전쟁 당사국들에게 고리의 빚을 빌리게 만들어 전쟁당사국을
가을 수 없는 부채로 지배하기 위해 그들이 항상 계획하는 것이다.



그들은 인류가 진보시킨 과학뿐만아니라 인류의 지혜로 더욱 악랄하게 진보된 정책과 제도로 인류를 지배하는 것이다. 어설픈 지식 몇개 외워서 그들은 분간이라도 할 수 있다고 상상하지 마라 그들은 그런 수준에서 가늠조차 할 수 있는 존재들이 아니다. 이런 얘기를 해주는 이유는 죽더라도 알아라는 의미도 있지만 이것도 모르면서 온 나라로 구성된 세계의 지배적 이념이 민주주주의라고 주권을 선거로 행사하기 때문이다. 이들은 인류가 모신 신의 위치에 오른 것이다. 그래서 인류 수준을 소와 돼지 수준이라 이것을 인식할 수 없다 말하고, 전쟁을 일으켜 죽어가는 인류를 향해 This is the art라고 자화자찬하는 것이다



경제가 성장하는 인도와 중국의 금과 은 사랑을 넘어선 집착 = 화폐지식과 진정한 화폐인 금과 은에 대한 이해

유대인과 더불어 세계에서 화폐지식이 남다른 민족이 화교로 대표되는 중국인이고, 앞으로 경제가 더욱 성장한 인도의 금과 은에 대한 사랑과 집착은 인도의 국가적 태양광 산업에 필요한 은의 수요를 초월. 2024년 1월부터 4월까지 4,172톤 수입(23년 1만톤 육박?). 인도의 금과 은수입도 산업적 측면과 금융패권적 측면에서 이해해야 하는 이유는 BRICs핵심멤버. 이런 이유로 화폐전쟁의 저자인 쑹훙빙은 화폐전쟁3편 10장. 은의 영광과 몽상편에서 수백개 산업에서 사용되는 은은 인류 역사에서 최초로 사라질 금속으로 미래에 금과 은의 존재비에서 1대 1이 될 가능성이 있다고 말한 것이다.

2000년대 초반 세계 최고수준의 금과 은의 매장량을 바탕으로 생산하는 중국이 자국에서 생산된 금과 은의 수출을 금지한 것도 화폐적 지식과 세계적인 금융패권에서 기인한 것을 기억해야 한다.


인류가 거래하는 은가격은 실물의 수용와 공급이 아닌 오직 서양금융가들이 지배하는 종이은을 매도하여 만들어진 은선물시장의 가격이라는 것을 잊어서는 안된다. 종이로 금을 살 수 있다는 것을 이해했기에 서양에서 연금술연구가 사라진 이유이다. 은투자의 대명사 헌트형제의 사건의 핵심은 그들이 은가격을 조작해서 정의의 이름으로 정부가 벌금으로 파산시킨 것이 아니다. 핵심은 그들이 은을 담보로 대출을 받았고, 그들이 거래소에서 매입한 은선물의 양이 거래소가 보유한 실제 은의 양을 초과했다는 사실이 되어야 한다. 진정한 조작은 바로 제도권이다. 여우가 닭장의 문고리를 잡고 있다는 사실이다. 이것을 이해하지 못하는 인류가 모순된 이념으로 갈등하고 대립하도록 모순된 이념을 만들어 놓은 것이다. 이념의 전제조건조차 인식하지 못하는 인류는 그 모순된 것이 자신의 이성과 지성의 표상이자 신념이 되어 죽도록 싸우는 것이다.■포식자가 후원자가 되고 보호자가 되어 국가와 제도로 국민을 노예로 지배하는 것이다. 그 사이에서 인류를 하나씩 정복해 나가는 것이다. ■돈과 화폐의 차이는 유튜브에 수많은 영상이 존재.

자연법칙과 상식의 모순을 이해하면 서양 문명의 철학과 사상, 종교와 윤리에 근거하여 만들어진 모든 것이 불가능을 가능과 능력으로 자신의 이성과 지성으로 이행하기 때문에 스스로 갚을 수 없는 부채노예가 되는 사악한 사기와 기만, 공상과 환상에 근거한 허상이라는 것을 인간과 신의 인식의 근원인 자연법칙과 수학으로 인식하게 되므로 붕괴된 것이 문제가 아니라 화폐와 금융을 이해하지 못하면 자신의 이성과 지성의 신념으로 행하는 모든 행위, 심지어 로 국제법과 국제기구로 인류를 위해 헌신한다고 착각하지만자신을 죽이고 국가를 해체하여 인류를 노예화하여 노예문명을 실현하는 노리개 인생에 불과하다는 것이다. 가장 대표적인 세력인 쌀동네 정보국들이다. 영화에서 인류와 세계를 만날 구하는^^. 이것이 민주주의의 탈을 쓴 자의 자연법칙과 수학이라는 인간과 신의 인식의 근원인 자연법칙과 상식의 모순을 이해할 때 주어지는 수학의 가치를 인문학적으로 설멸할 수 있는 실체이다.





서양의 국제은행가 지도 아래 조작되는 금은가격의 최대수혜자는 바로 그들의 정복의 도구이자 정복된 국가들을 수호하는 미국의 달러패권에 금과 은으로 도전하는 인도와 중국이 되는 형국이다. 그들이 바로 석유달러의 패권에 도전하는 금융과 화폐제도에 금과 은으로 도전할 것이다. 돈과 화폐의 가치 이해.

한국의 금융과 화폐의 수준은 소 팔러 가는데 개 따라 가는 수준. 마치 조선의 양반들처럼 인간의 생존에 필요한 재화의 생산이 자연과 노동에 절대적으로 예속된 시대를 살면서 오직 그 전제조건을 전환시키는 과학의 지식은 하찮게 여기면서 오직 그 부족한 재화의 분배를 봉건적 계급질서에서 백성을 생존의사선으로 내몰면서 피고름으로 호의호식하면서도 공자왈 맹자왈로 생명을 버리지 않고서는 생존할 수 없는 도덕으로 죄의식과 수치심으로 지배를 합리화하는 수준, 현대의 오직 특정한 가정과 전제조건의 고립되고 제한된 가정에서 논리를 전개하여 현실에서 단 하나의 현상도 설명하지 못하고 허공에 집을 짓는 경제학처럼.




이 글이 가치가 있을까??

패권경쟁국들은 달걀을 깨고 나와 병아리가 되려고 저토록 노력하는데 그를 용기도 지식도 없는 한국의 자칭 거짓의 지식을 외워서 지식인으로 착각하는 소위 자칭 엘리트들은 국민을 희생시켜서 달걀을 깨서 후라이로 아침식사나 거하게 하려는 수준에게 이 글이 가치가 있을까??


인도와 중국이 미국의 패권에 도전할 수 있는 이유, 일본이 메이지유신으로 유일하게 제국주의로나아간 이유와 독일 ㅡ 1차 세계대전으로 피폐한 독일이 국가의 부를 초월하는 배상금과 국제은행가들이 설정해 놓은 해외무역의 제한과 해외의 모든식민지의 소멸에도 ㅡ 서구유럽 전체와 미국과 소련의 다국적 연합국과 대적할 수 있어던 이유는 바로 미국의 개척시대를 넘어 인류 최고의 위대한 미국을 사랑한 미국 국가주의자들이 금권에 의한 링컨의 죽음 이후 인류 전체가 소수의 은행가들에게 지배될 위험으로부터 인류를 구하기 위해 건내준 화폐와 금융의 지식 때문이다."
2024.05.23 03:27,금투세 이런거랍니다 ,42556,0,0,"불의에 맞서는 기자님들이
이제 정의로운 펜의
힘을 보여 주시네요

아시아 타임즈 김지호 기자님 기사

https://m.asiatime.co.kr/article/20240522500463"
2023.06.21 22:36,이름이 너무 이쁘네요,144683,1,0,"아리랑이라니 ㄷㄷ

아리랑 고배당이랑 같이 매수하고 싶네요"
